{
  "schema_version": "svetlost33-release-set-2",
  "release_set_id": "shared-saints104-2026-10-06-m0v2-s13",
  "sequence": 13,
  "channel": "production",
  "key_id": "svetlost33-content-2026-key-1",
  "approved_platforms": [
    "android",
    "ios"
  ],
  "min_clients": {
    "android": 66,
    "ios": "0.1.14"
  },
  "modules": [
    {
      "module_id": "library-annual-2026-r1",
      "module_type": "library",
      "version": "2026.1.1",
      "required": true,
      "manifest_path": "releases/shared-annual-2026-r1-m0v2-s2/modules/library-annual-2026-r1-2026.1.1-r2/manifest.json",
      "manifest_bytes": 3329,
      "manifest_sha256": "5247bedb3d3deaf5f81601ff2f7a274417b0ce11ac1cebbb3f4b518cd26ee16d",
      "signature_path": "releases/shared-annual-2026-r1-m0v2-s2/modules/library-annual-2026-r1-2026.1.1-r2/manifest.sig"
    },
    {
      "module_id": "daily-cycles-r1",
      "module_type": "cycles",
      "version": "2026.1.2",
      "required": true,
      "manifest_path": "releases/shared-widget-excerpts-2026-09-18-m0v2-s4/modules/daily-cycles-r1-2026.1.2-r3/manifest.json",
      "manifest_bytes": 1118,
      "manifest_sha256": "b20e5ff4f29faf3b18b4e1e23d37dd5384a00b9cb54567fb838de71b095a630d",
      "signature_path": "releases/shared-widget-excerpts-2026-09-18-m0v2-s4/modules/daily-cycles-r1-2026.1.2-r3/manifest.sig"
    },
    {
      "module_id": "calendar-2026-r1",
      "module_type": "calendar",
      "version": "2026.1.1",
      "required": true,
      "manifest_path": "releases/shared-annual-2026-r1-m0v2-s2/modules/calendar-2026-r1-2026.1.1-r2/manifest.json",
      "manifest_bytes": 630,
      "manifest_sha256": "11e5d8b92ebbacd40ae6d0bad861c85a2df8220cd0b1091a2b7522754d538905",
      "signature_path": "releases/shared-annual-2026-r1-m0v2-s2/modules/calendar-2026-r1-2026.1.1-r2/manifest.sig"
    },
    {
      "module_id": "organizations-v1",
      "module_type": "organizations",
      "version": "2026.9.30",
      "required": false,
      "manifest_path": "releases/shared-content-refresh-2026-09-30-m0v2-s11/modules/organizations-v1-2026.9.30-r3/manifest.json",
      "manifest_bytes": 530,
      "manifest_sha256": "e493239cd2f1a6012dc40ab84da56c20f7bd86fde6100bbda6dd1a6af7f5ed46",
      "signature_path": "releases/shared-content-refresh-2026-09-30-m0v2-s11/modules/organizations-v1-2026.9.30-r3/manifest.sig"
    },
    {
      "module_id": "saints-v1",
      "module_type": "library",
      "version": "2026.10.6",
      "required": false,
      "manifest_path": "releases/shared-saints104-2026-10-06-m0v2-s13/modules/saints-v1-2026.10.6-r5/manifest.json",
      "manifest_bytes": 586,
      "manifest_sha256": "049b54e85bd26b38ad909a39b8c54ebaae88790d9f6a7365507ab783d957b148",
      "signature_path": "releases/shared-saints104-2026-10-06-m0v2-s13/modules/saints-v1-2026.10.6-r5/manifest.sig"
    },
    {
      "module_id": "liturgical-catalog-v1",
      "module_type": "library",
      "version": "2026.10.6",
      "required": false,
      "manifest_path": "releases/shared-saints104-2026-10-06-m0v2-s13/modules/liturgical-catalog-v1-2026.10.6-r8/manifest.json",
      "manifest_bytes": 696,
      "manifest_sha256": "9e16fa38a8f6f2ca3e038582cbdea410a7e9f9856e7c14108891cd42427844ad",
      "signature_path": "releases/shared-saints104-2026-10-06-m0v2-s13/modules/liturgical-catalog-v1-2026.10.6-r8/manifest.sig"
    },
    {
      "module_id": "calendar-browser-v1",
      "module_type": "library",
      "version": "2026.10.6",
      "required": false,
      "manifest_path": "releases/shared-saints104-2026-10-06-m0v2-s13/modules/calendar-browser-v1-2026.10.6-r4/manifest.json",
      "manifest_bytes": 533,
      "manifest_sha256": "c07a825e17f617b81931eef25de9b94bbff7675b23afbfb0533a18cd8d364dae",
      "signature_path": "releases/shared-saints104-2026-10-06-m0v2-s13/modules/calendar-browser-v1-2026.10.6-r4/manifest.sig"
    }
  ]
}
