{
  "schema_version": "svetlost33-release-set-2",
  "release_set_id": "test-ks01-synthetic104-102",
  "sequence": 102,
  "channel": "production",
  "key_id": "ks01-test-transport-key-1",
  "approved_platforms": [
    "android",
    "ios"
  ],
  "min_clients": {
    "android": 1001,
    "ios": "99.0.1"
  },
  "modules": [
    {
      "module_id": "library-annual-2026-r1",
      "module_type": "library",
      "version": "2026.1.1",
      "required": true,
      "manifest_path": "modules/library-annual-2026-r1/manifest.json",
      "manifest_bytes": 3325,
      "manifest_sha256": "299a1db117028d52e63681bd688731fd9aeb2aa1ab59977c7dd0735361a9f484",
      "signature_path": "modules/library-annual-2026-r1/manifest.sig"
    },
    {
      "module_id": "daily-cycles-r1",
      "module_type": "cycles",
      "version": "2026.1.2",
      "required": true,
      "manifest_path": "modules/daily-cycles-r1/manifest.json",
      "manifest_bytes": 1114,
      "manifest_sha256": "3158c545a48956158404014fef806e649178495000ccfe18157c873e85995b20",
      "signature_path": "modules/daily-cycles-r1/manifest.sig"
    },
    {
      "module_id": "calendar-2026-r1",
      "module_type": "calendar",
      "version": "2026.1.1",
      "required": true,
      "manifest_path": "modules/calendar-2026-r1/manifest.json",
      "manifest_bytes": 626,
      "manifest_sha256": "a1273603f0ac956d4fed1188934bfde8bd15d596d6d41adec49acd2db7a7d5c9",
      "signature_path": "modules/calendar-2026-r1/manifest.sig"
    },
    {
      "module_id": "saints-v1",
      "module_type": "library",
      "version": "test.ks01.104",
      "required": false,
      "manifest_path": "modules/saints-v1/manifest.json",
      "manifest_bytes": 586,
      "manifest_sha256": "6b97533ae3d774ea1e7b491bce16a34f636e2109e52a240df4a344132f457e20",
      "signature_path": "modules/saints-v1/manifest.sig"
    },
    {
      "module_id": "liturgical-catalog-v1",
      "module_type": "library",
      "version": "test.ks01.104",
      "required": false,
      "manifest_path": "modules/liturgical-catalog-v1/manifest.json",
      "manifest_bytes": 700,
      "manifest_sha256": "fc6259f7a88e2e576c13fa69b8e89dcd575250f39c718c3a2db967c4dfa52dda",
      "signature_path": "modules/liturgical-catalog-v1/manifest.sig"
    },
    {
      "module_id": "calendar-browser-v1",
      "module_type": "library",
      "version": "test.ks01.104",
      "required": false,
      "manifest_path": "modules/calendar-browser-v1/manifest.json",
      "manifest_bytes": 533,
      "manifest_sha256": "ff768db2bf2f1057f465f3ad4cb4cd37ef07e127272e9427edf49695bc338b22",
      "signature_path": "modules/calendar-browser-v1/manifest.sig"
    }
  ]
}
