{
  "schema_version": "svetlost33-release-set-2",
  "release_set_id": "test-ks01-real104-baseline62-200",
  "sequence": 200,
  "channel": "production",
  "key_id": "ks01-real-draft104-test-key-1",
  "approved_platforms": [
    "android",
    "ios"
  ],
  "min_clients": {
    "android": 1000,
    "ios": "99.0.0"
  },
  "modules": [
    {
      "module_id": "library-annual-2026-r1",
      "module_type": "library",
      "version": "2026.1.1",
      "required": true,
      "manifest_path": "modules/library-annual-2026-r1/manifest.json",
      "manifest_bytes": 3329,
      "manifest_sha256": "f915ec20e12f11cbe3022dd15d729e1d0fe312efea02a952c516fe3072fa51b5",
      "signature_path": "modules/library-annual-2026-r1/manifest.sig"
    },
    {
      "module_id": "daily-cycles-r1",
      "module_type": "cycles",
      "version": "2026.1.2",
      "required": true,
      "manifest_path": "modules/daily-cycles-r1/manifest.json",
      "manifest_bytes": 1118,
      "manifest_sha256": "64bff62c8587b42ed3b1cf9e791e897a26e506d3fb10c634948af66d03fc9d1b",
      "signature_path": "modules/daily-cycles-r1/manifest.sig"
    },
    {
      "module_id": "calendar-2026-r1",
      "module_type": "calendar",
      "version": "2026.1.1",
      "required": true,
      "manifest_path": "modules/calendar-2026-r1/manifest.json",
      "manifest_bytes": 630,
      "manifest_sha256": "a918e5784ac9e06f79dba5d3a51deb0511f544b21cad4f73d3e29721bcdaf377",
      "signature_path": "modules/calendar-2026-r1/manifest.sig"
    },
    {
      "module_id": "saints-v1",
      "module_type": "library",
      "version": "2026.9.30",
      "required": false,
      "manifest_path": "modules/saints-v1/manifest.json",
      "manifest_bytes": 586,
      "manifest_sha256": "53e265d0dd93770a6c0cf81e1d132e40457d417b7812f7283c09101be8848bb0",
      "signature_path": "modules/saints-v1/manifest.sig"
    },
    {
      "module_id": "liturgical-catalog-v1",
      "module_type": "library",
      "version": "2026.10.1",
      "required": false,
      "manifest_path": "modules/liturgical-catalog-v1/manifest.json",
      "manifest_bytes": 695,
      "manifest_sha256": "87518d8bd723f51176dc0e92ead0e280b9b28af776b5c80bbe23d2a00b88f328",
      "signature_path": "modules/liturgical-catalog-v1/manifest.sig"
    },
    {
      "module_id": "calendar-browser-v1",
      "module_type": "library",
      "version": "2026.10.2",
      "required": false,
      "manifest_path": "modules/calendar-browser-v1/manifest.json",
      "manifest_bytes": 533,
      "manifest_sha256": "c0d38e4542a0da8e6368985a1803157c6237b933fbbc569d957e452f167f109f",
      "signature_path": "modules/calendar-browser-v1/manifest.sig"
    }
  ]
}
